{"$schema":"https://json-schema.org/draft/2020-12/schema","type":"object","required":["schema_version","id","revision","text","requirements","offline"],"properties":{"schema_version":{"const":1},"id":{"type":"string","minLength":1},"revision":{"type":"integer","minimum":1},"text":{"type":"string","minLength":1},"offline":{"type":"boolean"},"requirements":{"type":"array","items":{"type":"object","required":["id","text","source","kind","status"],"properties":{"id":{"type":"string","minLength":1},"text":{"type":"string","minLength":1},"source":{"enum":["user","environment","inference","experiment"]},"kind":{"enum":["hard","preference","acceptance"]},"status":{"enum":["confirmed","unconfirmed","replaced"]}},"additionalProperties":false}},"answers":{"type":"object"},"existing_pipeline":{"type":"boolean"},"budget":{"type":"object"}},"additionalProperties":false}
