{"schema_version":1,"id":"materials-goal","revision":1,"text":"整理本地材料，保留来源，争议分类由我复核，输出可追溯的 JSONL 与 CSV。","offline":true,"requirements":[{"id":"R-SOURCE","text":"不得修改输入材料","source":"user","kind":"hard","status":"confirmed"},{"id":"R-REVIEW","text":"争议项必须经人工复核后完成","source":"user","kind":"acceptance","status":"confirmed"},{"id":"R-LOCAL","text":"本示例使用本地规则处理","source":"user","kind":"hard","status":"confirmed"}],"answers":{}}
